{
  "$schema": "https://json-schema.org/draft/2020-12/schema",
  "$id": "https://github.com/tjsasakifln/Governance/control-center/contracts/schemas/attention-item.v1.schema.json",
  "title": "AttentionItem v1",
  "description": "Exception or item requiring human attention. The homepage privileges these over KPI walls.",
  "type": "object",
  "additionalProperties": false,
  "required": [
    "schema_version",
    "id",
    "scope",
    "severity",
    "status",
    "title",
    "summary",
    "provenance",
    "detected_at",
    "homepage_eligible"
  ],
  "properties": {
    "schema_version": { "const": "control-center.attention-item.v1" },
    "id": {
      "$ref": "https://github.com/tjsasakifln/Governance/control-center/contracts/schemas/primitives.v1.schema.json#/$defs/resource_id"
    },
    "scope": {
      "$ref": "https://github.com/tjsasakifln/Governance/control-center/contracts/schemas/primitives.v1.schema.json#/$defs/scope"
    },
    "severity": {
      "type": "string",
      "enum": ["critical", "high", "medium", "low"]
    },
    "status": {
      "type": "string",
      "enum": ["open", "acknowledged", "resolved", "dismissed"]
    },
    "title": { "type": "string", "minLength": 1, "maxLength": 200 },
    "summary": { "type": "string", "minLength": 1, "maxLength": 2000 },
    "provenance": {
      "$ref": "https://github.com/tjsasakifln/Governance/control-center/contracts/schemas/primitives.v1.schema.json#/$defs/provenance"
    },
    "detected_at": {
      "$ref": "https://github.com/tjsasakifln/Governance/control-center/contracts/schemas/primitives.v1.schema.json#/$defs/utc_datetime"
    },
    "homepage_eligible": { "type": "boolean" },
    "recommended_action": { "type": "string", "minLength": 1, "maxLength": 1000 },
    "related_ids": {
      "type": "array",
      "maxItems": 32,
      "uniqueItems": true,
      "items": {
        "$ref": "https://github.com/tjsasakifln/Governance/control-center/contracts/schemas/primitives.v1.schema.json#/$defs/resource_id"
      }
    }
  }
}
